{
  "arms": [
    {
      "adapter": "codex",
      "arm": "vanilla",
      "cells": [
        {
          "cost_usd": 0.176655,
          "false_pass": false,
          "gate_passed": true,
          "latency_ms": 34167,
          "reasoning_effort": "medium",
          "task": "patch_unknown_id_returns_200",
          "tokens": 130299,
          "verified_acs": 7
        },
        {
          "cost_usd": 0.222114,
          "false_pass": false,
          "gate_passed": true,
          "latency_ms": 55560,
          "reasoning_effort": "medium",
          "task": "completed_not_persisted_to_list",
          "tokens": 161675,
          "verified_acs": 7
        },
        {
          "cost_usd": 0.232327,
          "false_pass": false,
          "gate_passed": true,
          "latency_ms": 47080,
          "reasoning_effort": "medium",
          "task": "default_completed_missing",
          "tokens": 171267,
          "verified_acs": 7
        }
      ],
      "ci": [0.29240177382128674, 1.0],
      "cost_per_verified_ac": 0.030052,
      "cost_usd_total": 0.6310960000000001,
      "false_pass_total": 0,
      "pass_at_1": 1.0,
      "passes": 3,
      "tokens_total": 463241,
      "trials": 3,
      "verified_acs_total": 21
    },
    {
      "adapter": "codex",
      "arm": "conveyor",
      "cells": [
        {
          "cost_usd": 0.164258,
          "false_pass": false,
          "gate_passed": true,
          "latency_ms": 32165,
          "reasoning_effort": "medium",
          "task": "patch_unknown_id_returns_200",
          "tokens": 121480,
          "verified_acs": 7
        },
        {
          "cost_usd": 0.188306,
          "false_pass": false,
          "gate_passed": true,
          "latency_ms": 43466,
          "reasoning_effort": "medium",
          "task": "completed_not_persisted_to_list",
          "tokens": 135119,
          "verified_acs": 7
        },
        {
          "cost_usd": 0.181291,
          "false_pass": false,
          "gate_passed": true,
          "latency_ms": 44477,
          "reasoning_effort": "medium",
          "task": "default_completed_missing",
          "tokens": 134372,
          "verified_acs": 7
        }
      ],
      "ci": [0.29240177382128674, 1.0],
      "cost_per_verified_ac": 0.025422,
      "cost_usd_total": 0.533855,
      "false_pass_total": 0,
      "pass_at_1": 1.0,
      "passes": 3,
      "tokens_total": 390971,
      "trials": 3,
      "verified_acs_total": 21
    }
  ],
  "confidence": 0.95,
  "k": 1,
  "lift": {
    "baseline_arm": "vanilla",
    "cost_per_verified_ac_ratio": 0.845934,
    "false_pass_delta": 0,
    "pass_at_1_delta": 0.0,
    "treatment_arm": "conveyor",
    "verified_acs_delta": 0
  },
  "reasoning_effort": "medium",
  "schema_version": "conveyor.eval_lift@1",
  "tasks": [
    "patch_unknown_id_returns_200",
    "completed_not_persisted_to_list",
    "default_completed_missing"
  ]
}
